{
  "session_id": "sess-main-001",
  "current_focus_family_id": "fam-intake",
  "updated_at": "2026-09-15T00:00:00Z",
  "families": {
    "fam-intake": {
      "family_id": "fam-intake",
      "repo": "acme-corp/office-skills-example",
      "issue": 77,
      "phase": "intake",
      "requirements_version": 1,
      "plan_version": 1,
      "routing_version": 1,
      "ownership": {
        "holder_id": "holder-002",
        "role": "orchestrator",
        "triple": "claude@local/opus@high"
      },
      "dependencies": [],
      "active_dispatches": [],
      "latest_landing": null,
      "pending_decisions": []
    }
  }
}
